{
  "schema": "wpno.level1.binding/1",
  "audit_id": "L1-A14",
  "binding_status": "EXTERNAL_EVIDENCE_REQUIRED",
  "logical_targets": [
    "davon BGH N accuracy on the real 43-citation document"
  ],
  "candidate_paths": [
    "/Users/martinotten/WPNO/authoring/AP18_referenzpruefung.py"
  ],
  "productive_target": null,
  "productive_target_sha256": null,
  "productive_target_evidence": [],
  "execution_path_evidence": [],
  "test_candidates": [],
  "related_components": [],
  "independent_reference_candidates": [],
  "external_evidence_required": [
    "REF-06"
  ],
  "unresolved_questions": [
    "The real 43-citation document is not in the repository."
  ],
  "discovery_drift": [],
  "source_evidence": [
    {
      "source_path": "/Users/martinotten/WPNO/authoring/AP18_referenzpruefung.py",
      "sha256": "f5eb5a9cbeb37cada9186ba305b9a307ea40e3012ca0e2e6dd0b2560f4352d74",
      "locator": "the davon BGH counter",
      "evidence_type": "source",
      "confidence": "HIGH"
    }
  ],
  "replications": 1,
  "risk": "CRITICAL",
  "execution_order": 18
}
