{
  "schema": "wpno.level1.binding/1",
  "audit_id": "L1-A28",
  "binding_status": "EXTERNAL_EVIDENCE_REQUIRED",
  "logical_targets": [
    "Independent messageDigest remeasurement"
  ],
  "candidate_paths": [],
  "productive_target": null,
  "productive_target_sha256": null,
  "productive_target_evidence": [],
  "execution_path_evidence": [],
  "test_candidates": [],
  "related_components": [],
  "independent_reference_candidates": [],
  "external_evidence_required": [
    "REF-11"
  ],
  "unresolved_questions": [
    "The signed content is not identified."
  ],
  "discovery_drift": [],
  "source_evidence": [],
  "replications": 1,
  "risk": "HIGH",
  "execution_order": 30
}
