{
  "schema": "wpno.level1.binding/1",
  "audit_id": "L1-A06",
  "binding_status": "TARGET_CONFIRMED",
  "logical_targets": [
    "Output guard permits the known-good report"
  ],
  "candidate_paths": [
    "/Users/martinotten/WPNO/authoring/AP17_output_guardrail_v3.py",
    "/Users/martinotten/WPNO/authoring/AP17_report.md",
    "/Users/martinotten/WPNO/authoring/AP17_report_v2.md"
  ],
  "productive_target": "/Users/martinotten/WPNO/authoring/AP17_output_guardrail_v3.py",
  "productive_target_sha256": "dd60dc63437691082b821fe219a7599c1561c757214a0e38eac97367ab2a09ca",
  "productive_target_evidence": [
    {
      "claim": "File identity confirmed by name, symbol match and SHA-256.",
      "note": "File identity is NOT production identity. No execution-path evidence establishes that this file is the copy invoked in production. See discovery_reconciliation/04_PRODUCTION_PATH_RECONCILIATION.md."
    }
  ],
  "execution_path_evidence": [],
  "test_candidates": [],
  "related_components": [],
  "independent_reference_candidates": [],
  "external_evidence_required": [],
  "unresolved_questions": [
    "What is 'report_good' on this machine?",
    "Which guardrail version is productive?"
  ],
  "discovery_drift": [
    "D-02"
  ],
  "source_evidence": [
    {
      "source_path": "/Users/martinotten/WPNO/authoring/AP17_output_guardrail_v3.py",
      "sha256": "dd60dc63437691082b821fe219a7599c1561c757214a0e38eac97367ab2a09ca",
      "locator": "whole file",
      "evidence_type": "source",
      "confidence": "HIGH"
    },
    {
      "source_path": "/Users/martinotten/WPNO/authoring/AP17_report.md",
      "sha256": null,
      "locator": "known-good artefact candidate",
      "evidence_type": "artifact",
      "confidence": "LOW"
    },
    {
      "source_path": "/Users/martinotten/WPNO/authoring/AP17_report_v2.md",
      "sha256": null,
      "locator": "known-good artefact candidate",
      "evidence_type": "artifact",
      "confidence": "LOW"
    }
  ],
  "replications": 1,
  "risk": "CRITICAL",
  "execution_order": 10
}
